{
  "schema_version": "2.7-group-manifest-1",
  "project_slug": "zhongruan-power",
  "project_name": "中软国际 Power 项目",
  "group_id": "group-a",
  "group_name": "A 组",
  "generated_at": "2026-08-09T10:10:00+08:00",
  "topics": [
    {
      "topic_slug": "opportunity-evaluation",
      "topic_name": "商机评估",
      "topic_meta_path": "opportunity-evaluation/topic_meta.json",
      "state_path": "opportunity-evaluation/state.json",
      "status_summary": {},
      "last_updated": "2026-08-09T10:00:00+08:00"
    },
    {
      "topic_slug": "customer-success-agent",
      "topic_name": "客户成功 Agent",
      "topic_meta_path": "customer-success-agent/topic_meta.json",
      "state_path": "customer-success-agent/state.json",
      "status_summary": {},
      "last_updated": "2026-08-09T09:30:00+08:00"
    }
  ]
}
